{
  "formatVersion": 1,
  "metadata": { "title": "Pedal held across a bar line" },
  "notes": [
    { "id": "a", "pitch": 48, "start": 0, "duration": 480, "velocity": 70 },
    { "id": "b", "pitch": 55, "start": 1920, "duration": 480, "velocity": 70 }
  ],
  "expression": {
    "pedals": [
      { "tick": 0, "pedal": "sustain", "value": 127 },
      { "tick": 3840, "pedal": "sustain", "value": 0 }
    ],
    "dynamics": [{ "tick": 1920, "level": "f", "rampFrom": "p", "rampStart": 0 }]
  }
}
